{"attempt":1,"files":{"map.json":"abd1fc0971a8f554b0735875cafca2264441dc50ea90af57b7a45cdc833896d3","summary.json":"ede3d2382fc820ad1f2da0ebd83b8d1cbb95eb2020bedbd8499ae8dc4f4fd304","timeline.json":"c312d35a537c5b4a9fc2ebb514e90e40e1716ef80b039393b7a5100be6f25306"},"generation":1,"measuredAt":"2026-10-27T16:50:43Z","methodology":"objdiff-report-v1","mode":"full","publishedAt":"2026-10-27T16:51:02Z","repository":"mitsevox/n100f","revision":"5b49b2e2fccf85c71d913e39af529e2e648f5572","runId":40544825730,"schemaVersion":1,"source":null,"target":{"console":"GameCube","id":"GIHE78","sha1":"c77fb29d39b5898933e8ef4d1ccd2ddac404554e"},"tree":"3083d8924b23e06268d2b8362227bd421ea8ccba","workflowBlob":"5410c40ec07189d65041423ec737f4fdd34e35ec"}
