{"attempt":1,"files":{"map.json":"9633402ee9fee2b635df025cffd58fda20c4eca31424a5e467860242b183f9c7","summary.json":"4d644de0e2790ec0c4cd2f70c3cc02ba6171ad6fa3c38f936691ff14dc7ee795","timeline.json":"dc16a18bf32a68deb80285cd542a31a124f53aa33f0eb4b3188142bc7070159d"},"generation":1,"measuredAt":"2026-10-26T23:04:41Z","methodology":"objdiff-report-v1","mode":"full","publishedAt":"2026-10-26T23:04:54Z","repository":"mitsevox/n100f","revision":"22ca160703e0f20d9215c88a0abeef6e96900d0c","runId":40417158540,"schemaVersion":1,"source":null,"target":{"console":"GameCube","id":"GIHE78","sha1":"c77fb29d39b5898933e8ef4d1ccd2ddac404554e"},"tree":"fc4c6711ccc60971658209f4bebc19791442532a","workflowBlob":"2b36a13322246c158f3159dc6f34328d86828f44"}
