{"attempt":1,"files":{"map.json":"4225097fc04f4442449acc94894c92f04330a6b99145da798e31c57079250426","summary.json":"da9165ffd38b085ccb981b0bff5b14ef3e5ecaa074ca3e5ef3f97b473cf51ef3","timeline.json":"fbf831f2a9782d913a5d3b7c0becdc66e4b60ce02767017103a5b0938650958f"},"generation":1,"measuredAt":"2026-10-26T20:49:56Z","methodology":"objdiff-report","mode":"full","publishedAt":"2026-10-26T20:49:56Z","repository":"mitsevox/tw2004","revision":"11985bcd413b9da33d0ae58de6877e0906dc6a59","runId":40398926691,"schemaVersion":1,"source":null,"target":{"console":"GameCube","id":"GW4E69","sha1":"bbbc55485e51973931dee169e7bf87bc7379223f"},"tree":"4e08ecefe608a9bfa7dd7e264990e57fff031967","workflowBlob":"9ed3eed6292124c40029f555ad75d4b8489878bb"}
