{"attempt":1,"files":{"contributors.json":"f68a177e089db4f6b07fe7d5e94319013fba08c7e77d8208394f14f89cbdff5b","map.json":"e03b630b62958fc8bfc9a837e98bf43fd1e58e31c68d086c6b565acacee1ca5e","summary.json":"8ec623a335090ba9551a64ae602c55412381274e760c764c938b4d99911fc221","timeline.json":"04cebb7868ba44cc5814fb956dcb5a1557d539275d71871ee4481706dc1ade5e"},"generation":1,"measuredAt":"2026-10-26T15:41:04.818396+00:00","methodology":"nflstreet2-report-v1","mode":"full","publishedAt":"2026-10-26T15:41:04.818396+00:00","repository":"mitsevox/nflstreet2","revision":"d7cff02326a4b371f00a6fad88bb7b603577d5b8","runId":40351178535,"schemaVersion":1,"source":null,"target":{"console":"GameCube","id":"GN7E69","sha1":"3561e946e9ff785b68692f87d2ba85d81fd2dcf4"},"tree":"03e94687c11f30a3e6cba577c0584485cc836e8a","workflowBlob":"f209bfa23df04f7da077f4ca93154da6fe8dddce"}
