{"attempt":1,"files":{"map.json":"0f2ee3672b4ba0a4f2fbf584b88d1ef80448d56be488f074b16d748140e49fe2","summary.json":"53f764535473808e754a3b9ae8d43b85c5b92761f990203963c13a83ce0ecb8d","timeline.json":"14be572e6c001114d743d9fe311be6db3f7207395ef35f590b4594d0074bb6b7"},"generation":1,"measuredAt":"2026-10-27T08:37:40Z","methodology":"objdiff-report-v1","mode":"full","publishedAt":"2026-10-27T08:37:56Z","repository":"mitsevox/n100f","revision":"8373ccb7e72ed9820f3796fce6a1b0c8ddc7b7c0","runId":40474793013,"schemaVersion":1,"source":null,"target":{"console":"GameCube","id":"GIHE78","sha1":"c77fb29d39b5898933e8ef4d1ccd2ddac404554e"},"tree":"6fe96fb879295cbaae2d8fb5bf3360fa2efd3704","workflowBlob":"5410c40ec07189d65041423ec737f4fdd34e35ec"}
