{"attempt":1,"files":{"map.json":"75a37aed84e44035209607998e68bb95726ae9493d888c9ab99cac8204031991","summary.json":"e0ea3e84593e486f6f1e8b3ad3fdfcfd57f77c0c4b4113d9d2a83e1aa3e2109d","timeline.json":"94786311927411216a4ad8b361aee7b637c2f66548611d67533b274a38d31bee"},"generation":1,"measuredAt":"2026-10-27T00:53:22Z","methodology":"objdiff-report-v1","mode":"full","publishedAt":"2026-10-27T00:53:35Z","repository":"mitsevox/n100f","revision":"a8600c5db9328dc36932ec918aa7c8eed6bfcac5","runId":40429192622,"schemaVersion":1,"source":null,"target":{"console":"GameCube","id":"GIHE78","sha1":"c77fb29d39b5898933e8ef4d1ccd2ddac404554e"},"tree":"5b91e064f0db0d67941971afd2c174858a8c5ef6","workflowBlob":"1d672d7fb38d9bee23c49fb1aeac0978812f105b"}
