{"attempt":1,"files":{"map.json":"3b5644c56258fddee40ed1a77b1346cb8d66d0570ec5f8798850f8382a34199b","summary.json":"59b8e19598945277866ca30cb8a12f82ad71ac8da2a144bc27569d78e21cb3b8","timeline.json":"d42ec16c92065c505c1cd2c6dedbcc46daf2d5da634c1c17be418cbf000618cf"},"generation":1,"measuredAt":"2026-10-27T00:26:57Z","methodology":"objdiff-report-v1","mode":"full","publishedAt":"2026-10-27T00:27:11Z","repository":"mitsevox/n100f","revision":"afb5650699686e065ed2a514f8240e74166b1f17","runId":40426423992,"schemaVersion":1,"source":null,"target":{"console":"GameCube","id":"GIHE78","sha1":"c77fb29d39b5898933e8ef4d1ccd2ddac404554e"},"tree":"b87579d8038c8df22e8e9c8486eb0a36caa457bc","workflowBlob":"1d672d7fb38d9bee23c49fb1aeac0978812f105b"}
