{"attempt":1,"files":{"map.json":"34a1518de7e05d575c522b0ef43ff4bdf6881cb751a495f69c8ebd7f0c017126","summary.json":"2ad59aed6ffb409e2cbace93b6771329656bbdbf38304c21ff54a3b71b5f47d5","timeline.json":"4aecfa618f4b204100dd1862b6d0e14fe893fb6f12756d0e618be8505a3dc4e7"},"generation":1,"measuredAt":"2026-10-27T02:22:45Z","methodology":"objdiff-report-v1","mode":"full","publishedAt":"2026-10-27T02:22:59Z","repository":"mitsevox/n100f","revision":"908ee6fe5521e7e83be855dbb58849a31fc14db9","runId":40438046367,"schemaVersion":1,"source":null,"target":{"console":"GameCube","id":"GIHE78","sha1":"c77fb29d39b5898933e8ef4d1ccd2ddac404554e"},"tree":"01eafa6313828b690521ffd774efc5d0eb88bafb","workflowBlob":"1d672d7fb38d9bee23c49fb1aeac0978812f105b"}
