{"attempt":1,"files":{"map.json":"1c6601c3c8de7d4f748cd89d955c20848277d119c0d3a6b6469722cf13a0c401","summary.json":"974b5f13b3675ead9d83297ded284251c2bc83ac06a662fe939fdafe2e29d90e","timeline.json":"11f5ae3ddd92f3e0746a23f407ebeceafefc151af3323d38e2d3bea30e4bc442"},"generation":1,"measuredAt":"2026-10-27T01:20:57Z","methodology":"objdiff-report-v1","mode":"full","publishedAt":"2026-10-27T01:21:13Z","repository":"mitsevox/n100f","revision":"a407f0b5e9a1e0a4bff97c9399ca734158a1bc5b","runId":40432012354,"schemaVersion":1,"source":null,"target":{"console":"GameCube","id":"GIHE78","sha1":"c77fb29d39b5898933e8ef4d1ccd2ddac404554e"},"tree":"c54d41263f895225142fbb0b4485af220a594c19","workflowBlob":"1d672d7fb38d9bee23c49fb1aeac0978812f105b"}
