{"attempt":1,"files":{"map.json":"f46742080a94d4bff1183bd43678f7a76fb45b28b1ab4d0dc195908f54dc911b","summary.json":"00b541d9550905e3514b5d5eca91619965cd720d7fa0a4ccbb691cd1d96188af","timeline.json":"fd57e98aeeccf98515b6ec65c3b6a179bd7e94414079d376822beca7f1d29804"},"generation":1,"measuredAt":"2026-10-26T23:52:58Z","methodology":"objdiff-report-v1","mode":"full","publishedAt":"2026-10-26T23:53:16Z","repository":"mitsevox/n100f","revision":"ba50e81b6cbe587ade36994db0379d5d8444c941","runId":40422714148,"schemaVersion":1,"source":null,"target":{"console":"GameCube","id":"GIHE78","sha1":"c77fb29d39b5898933e8ef4d1ccd2ddac404554e"},"tree":"e89f5ff0498c0b54a0d04ab0e57ecd1012764b48","workflowBlob":"2b36a13322246c158f3159dc6f34328d86828f44"}
