{"attempt":1,"files":{"summary.json":"7f82f99dd0d33fc2ea1c5ab30be89f290f5ce08037bc0d3f31a71ca3b6f3c0b8"},"generation":1,"measuredAt":"2026-10-25T22:10:05Z","methodology":"objdiff-report-v1","mode":"full","publishedAt":"2026-10-25T22:10:06Z","repository":"mitsevox/mvp2005","revision":"e320d292da310b487219a1245d2da0283be9be15","runId":40238860990,"schemaVersion":1,"source":null,"target":{"console":"GameCube","id":"GV4E69","sha1":"da6becdbea614d03c4b5eae9f8a0fb08e0a184dd"},"tree":"e60718fd9cb26a3d31aafe790e955006f898db8b","workflowBlob":"09126e7990c15b05021296a551b950bcb1429374"}
