{"attempt":1,"files":{"map.json":"c93f6f7a0e05d9bd03e924dbce76bd13c37170d0503c746e908ccb249cb44d8f","summary.json":"250b6e1e400cb42555383499cf9d65d279fe8aaa4c4837916bed490e8a0b6510","timeline.json":"d5a28c2a62aff404e17e363964c5079c49dfdb6237b3de6f6a9f730348462c6e"},"generation":1,"measuredAt":"2026-10-27T00:56:44Z","methodology":"objdiff-report-v1","mode":"full","publishedAt":"2026-10-27T00:56:59Z","repository":"mitsevox/n100f","revision":"59e6a4a52f1738a75a55046f9e97df280d7ad725","runId":40429548554,"schemaVersion":1,"source":null,"target":{"console":"GameCube","id":"GIHE78","sha1":"c77fb29d39b5898933e8ef4d1ccd2ddac404554e"},"tree":"da3244552d467ea1785b9f6939109fa2674a6133","workflowBlob":"1d672d7fb38d9bee23c49fb1aeac0978812f105b"}
