{"attempt":1,"files":{"map.json":"2a6bd42cd3cbee0d9fd823cb2f92c1161ecb238831a04f88e69aea48494ad755","summary.json":"fde622777471cb2c70d1b6fdf4c3c4f11f80e8c12c8d0b1358b30d54821b08bb","timeline.json":"dda8008ea4ae95060a1b6c1e0479de329c63d227e8e2f0971598dac1951813d9"},"generation":1,"measuredAt":"2026-10-27T15:17:40Z","methodology":"objdiff-report-v1","mode":"full","publishedAt":"2026-10-27T15:17:58Z","repository":"mitsevox/n100f","revision":"3e219c8bc8505d339bf959b8d6d433428b15b115","runId":40529475323,"schemaVersion":1,"source":null,"target":{"console":"GameCube","id":"GIHE78","sha1":"c77fb29d39b5898933e8ef4d1ccd2ddac404554e"},"tree":"dbd7361873f71f22232126180785a36e8ab81296","workflowBlob":"5410c40ec07189d65041423ec737f4fdd34e35ec"}
