{"attempt":1,"files":{"map.json":"13fce033d9e342c61937ffe3ecb92751a39d1163eae1a3cc8b9712af16421970","summary.json":"e0b2f8673e46a5ca631d04c5c65759007f46de3efc4d17e2d2d5f0bbc3451207","timeline.json":"10a27bb7e971a3bd127579289845c143d562915cf135fde9ca227f72744aee36"},"generation":1,"measuredAt":"2026-10-27T03:11:29Z","methodology":"objdiff-report-v1","mode":"full","publishedAt":"2026-10-27T03:11:45Z","repository":"mitsevox/n100f","revision":"40dc4544523971f287fd7067da33a685fdf9b823","runId":40442747328,"schemaVersion":1,"source":null,"target":{"console":"GameCube","id":"GIHE78","sha1":"c77fb29d39b5898933e8ef4d1ccd2ddac404554e"},"tree":"f3171393a7c09bfba824ec9be58b3626d3cd6fe9","workflowBlob":"1d672d7fb38d9bee23c49fb1aeac0978812f105b"}
