{"attempt":1,"files":{"map.json":"6ef0d7d8762a2058b917893c244f0344622ca5def51eb071ce4fd3b3ddd96aa8","summary.json":"e47765853320b691202b88d801fe7ac33498213dbbf3e842390ff8674404d054","timeline.json":"db8faf5fc8ec5663bde118bde07726333e3e62c4df6fe20d201b89364d6ab44d"},"generation":1,"measuredAt":"2026-10-25T23:33:34Z","methodology":"objdiff-report-v1","mode":"full","publishedAt":"2026-10-25T23:33:38Z","repository":"mitsevox/mvp2005","revision":"1e8c7fc4032c63bf235fe378e109a5d745735024","runId":40245264545,"schemaVersion":1,"source":null,"target":{"console":"GameCube","id":"GV4E69","sha1":"da6becdbea614d03c4b5eae9f8a0fb08e0a184dd"},"tree":"bdb0544cf57459dc4d100b17c643ee5d96c47394","workflowBlob":"7c6f2fd9d40d145ed449ffc61f0b6aabe53511b9"}
