{"attempt":1,"files":{"map.json":"4225097fc04f4442449acc94894c92f04330a6b99145da798e31c57079250426","summary.json":"da9165ffd38b085ccb981b0bff5b14ef3e5ecaa074ca3e5ef3f97b473cf51ef3","timeline.json":"53efbef8805617ca06cef6269885e31d7d06ee454e87cf73890ad650430b96a6"},"generation":1,"measuredAt":"2026-10-25T22:18:56Z","methodology":"objdiff-report","mode":"full","publishedAt":"2026-10-25T22:18:56Z","repository":"mitsevox/tw2004","revision":"7d796299af2170c235266b68c30c5dd17108997c","runId":40239512339,"schemaVersion":1,"source":null,"target":{"console":"GameCube","id":"GW4E69","sha1":"bbbc55485e51973931dee169e7bf87bc7379223f"},"tree":"48c3dc8e9c85b2d11d22902477eba200cdc34bda","workflowBlob":"2b531af751ea739676515258c6b021ce3b30fb73"}
