{"attempt":1,"files":{"map.json":"79111233aff761f1043cb0b4a173ed535b2b1999eafe0f989795da800aed71c9","summary.json":"3943bdf00d2bd528019d1585572ea0d7ee363a24c32dc6153e2154add5854e13","timeline.json":"c125409475f3a9a82f00f0b8dc40d6c400e555dc050a65791781d73065fdb9d9"},"generation":1,"measuredAt":"2026-10-27T02:09:57Z","methodology":"objdiff-report-v1","mode":"full","publishedAt":"2026-10-27T02:10:10Z","repository":"mitsevox/n100f","revision":"5af783ea79ed858d04b65ec9225242a94b556572","runId":40436811384,"schemaVersion":1,"source":null,"target":{"console":"GameCube","id":"GIHE78","sha1":"c77fb29d39b5898933e8ef4d1ccd2ddac404554e"},"tree":"6070ffc687df62c36ac7a2e5149975be3cdd4b33","workflowBlob":"1d672d7fb38d9bee23c49fb1aeac0978812f105b"}
