{"attempt":1,"files":{"contributors.json":"f68a177e089db4f6b07fe7d5e94319013fba08c7e77d8208394f14f89cbdff5b","map.json":"e03b630b62958fc8bfc9a837e98bf43fd1e58e31c68d086c6b565acacee1ca5e","summary.json":"8ec623a335090ba9551a64ae602c55412381274e760c764c938b4d99911fc221","timeline.json":"d2cab886ba5fc5b52b6e20d835b348b78176fed3b1df96fe7f3ba1701d87a8eb"},"generation":1,"measuredAt":"2026-10-26T20:57:37.624145+00:00","methodology":"nflstreet2-report-v1","mode":"full","publishedAt":"2026-10-26T20:57:37.624145+00:00","repository":"mitsevox/nflstreet2","revision":"fd98b7a558e45ea93121a4f960cab719e1d37b2a","runId":40399766438,"schemaVersion":1,"source":null,"target":{"console":"GameCube","id":"GN7E69","sha1":"3561e946e9ff785b68692f87d2ba85d81fd2dcf4"},"tree":"a9cc503aa75495b38e2297878f0512f38a462862","workflowBlob":"f209bfa23df04f7da077f4ca93154da6fe8dddce"}
