{"attempt":1,"files":{"map.json":"07a8f22fb540550d4be74d4ef42ccc41461e8bdad0d4d0dd450d2b168a39ceb1","summary.json":"10471f026130c08f7b6db1156e798626c977f30c1a75615be56c96e62fd128fd","timeline.json":"62fb087286df617a3624cc298c48a1662a07707a96c35a8109755e9f6dd4d0db"},"generation":1,"measuredAt":"2026-10-26T17:05:21Z","methodology":"objdiff-report-v1","mode":"full","publishedAt":"2026-10-26T17:05:33Z","repository":"mitsevox/n100f","revision":"0b094077025fde29b0bba6a1b3781831d4c6dbca","runId":40365285351,"schemaVersion":1,"source":null,"target":{"console":"GameCube","id":"GIHE78","sha1":"c77fb29d39b5898933e8ef4d1ccd2ddac404554e"},"tree":"20c8aeb6b46587b20e7a8218f02fd144531f224a","workflowBlob":"4358db0f428d68ba6e99fd332dd27b2505c278c9"}
