{"attempt":1,"files":{"map.json":"08d7b0ebc6ffb02a22b509ee6f0566332ff3206cec616d6c53408c0c40fc23cc","summary.json":"7b9c494ec8b21b25b2ab8ee9f53597e9e55ad2688206bebc38ad169632eaa345","timeline.json":"7547a639bd71b4b88709db44a21bc4503ddbc25f5e676d2b0e8b99c6cff316a0"},"generation":1,"measuredAt":"2026-10-26T19:30:08Z","methodology":"objdiff-report-v1","mode":"full","publishedAt":"2026-10-26T19:30:22Z","repository":"mitsevox/n100f","revision":"7bcf412826103f79d58771ca46da03cae74b099f","runId":40387263093,"schemaVersion":1,"source":null,"target":{"console":"GameCube","id":"GIHE78","sha1":"c77fb29d39b5898933e8ef4d1ccd2ddac404554e"},"tree":"30e3e60b54c7c0a218aa45f9ecd5a203321913f5","workflowBlob":"2b36a13322246c158f3159dc6f34328d86828f44"}
