{"attempt":1,"files":{"map.json":"78da11dc0a8025c6f7b48a3aa0cd3a1f075aeef14af554e9af4af52d3d106759","summary.json":"3506ac4c7e53617bfc3c203f1a2e9d704b7d4c1a97c2dd265eb3443d14d9fa72","timeline.json":"f55dab024b38c9553b09216a727eda10f6a358137433df2cb974643ce9f61333"},"generation":1,"measuredAt":"2026-10-27T00:33:59Z","methodology":"objdiff-report-v1","mode":"full","publishedAt":"2026-10-27T00:34:11Z","repository":"mitsevox/n100f","revision":"4beded7f69461e8411a557530e0970a6fbc1cd98","runId":40427183326,"schemaVersion":1,"source":null,"target":{"console":"GameCube","id":"GIHE78","sha1":"c77fb29d39b5898933e8ef4d1ccd2ddac404554e"},"tree":"8943bd1c2db6316aa0eca8322ac697dc09d9f42f","workflowBlob":"1d672d7fb38d9bee23c49fb1aeac0978812f105b"}
