{"attempt":1,"files":{"map.json":"03a43ffac9966395d2831ad63c4dc6c033b410e04a2dc351c38157d7b24d187d","summary.json":"ddc31381e0ee6241406be74a1a3a884088f7a77db97db78eb9978b52d50ce090","timeline.json":"f7dc3d82784ba486068155408d158b01dfa98c2c4609b930895434947d5cbcf8"},"generation":1,"measuredAt":"2026-10-27T00:59:24Z","methodology":"objdiff-report-v1","mode":"full","publishedAt":"2026-10-27T00:59:40Z","repository":"mitsevox/n100f","revision":"b5faf3bf40776303db6714f4e7f20ce29fbaeeb6","runId":40429803048,"schemaVersion":1,"source":null,"target":{"console":"GameCube","id":"GIHE78","sha1":"c77fb29d39b5898933e8ef4d1ccd2ddac404554e"},"tree":"fbc741f4df98f64cdbe1461cee5e60daa95d5b71","workflowBlob":"1d672d7fb38d9bee23c49fb1aeac0978812f105b"}
