{"attempt":1,"files":{"map.json":"6ef0d7d8762a2058b917893c244f0344622ca5def51eb071ce4fd3b3ddd96aa8","summary.json":"b377ea7b96d60a2a65f8abc646a4684d701d3aab1ed217c5362c44d6db18e2fc","timeline.json":"329c280b28155ccab2ea4e2a3ee112ce497a3f0d63df84a2974953ab9333bb9f"},"generation":1,"measuredAt":"2026-10-25T23:53:29Z","methodology":"objdiff-report-v1","mode":"full","publishedAt":"2026-10-25T23:53:32Z","repository":"mitsevox/mvp2005","revision":"2bac97a534cb18037393c567e3c083589ebb11bb","runId":40246721083,"schemaVersion":1,"source":null,"target":{"console":"GameCube","id":"GV4E69","sha1":"da6becdbea614d03c4b5eae9f8a0fb08e0a184dd"},"tree":"9e442f8d7db3feaada3e9da963e68f06a945e4c5","workflowBlob":"7c6f2fd9d40d145ed449ffc61f0b6aabe53511b9"}
