{"attempt":1,"files":{"map.json":"da6544bd4a22b09e38446fd560697d0cdb35c88c3dec101dc49531d43e300795","summary.json":"570b54071155710ab3665c81b2c68fd2bbc92f7fee68d4b64cb9e3a64c0eb521","timeline.json":"1c5536651485ae46c877c85690ebf05b0cda5f27e06f97672f2f61c017a1115a"},"generation":1,"measuredAt":"2026-10-27T01:10:13Z","methodology":"objdiff-report-v1","mode":"full","publishedAt":"2026-10-27T01:10:29Z","repository":"mitsevox/n100f","revision":"8441493436070c6dd882f42ebfade5464a2f4f58","runId":40430924401,"schemaVersion":1,"source":null,"target":{"console":"GameCube","id":"GIHE78","sha1":"c77fb29d39b5898933e8ef4d1ccd2ddac404554e"},"tree":"c2cf9049645ee74bd605fd284a13622ab0d1b5fa","workflowBlob":"1d672d7fb38d9bee23c49fb1aeac0978812f105b"}
